[
  {
    "study_id": "stu_0001",
    "full_citation": "Pelland et al. (2025). The Resistance Training Dose Response: Meta-Regressions Exploring the Effects of Weekly Volume and Frequency on Muscle Hypertrophy and Strength Gains. Sports Medicine. https://doi.org/10.1007/s40279-025-02344-w",
    "publication_year": 2025,
    "authors": "Pelland et al.",
    "study_title": "The Resistance Training Dose Response: Meta-Regressions Exploring the Effects of Weekly Volume and Frequency on Muscle Hypertrophy and Strength Gains",
    "journal": "Sports Medicine",
    "doi": "10.1007/s40279-025-02344-w",
    "permanent_url": "https://doi.org/10.1007/s40279-025-02344-w",
    "study_type": "systematic_review_meta_analysis",
    "research_topic": "volume_frequency",
    "male_only_sample": false,
    "mixed_sex_sample": true,
    "male_results_reported_separately": false,
    "male_sample_size": null,
    "total_sample_size": null,
    "participant_training_status": "mixed",
    "participant_age_mean": null,
    "participant_age_range": "adult",
    "natural_or_enhanced": "not_reported",
    "study_duration_weeks": null,
    "intervention": "Evidence synthesis of resistance-training interventions",
    "comparator": "Varied by included study",
    "training_protocol": "Varied by included study",
    "nutrition_conditions": "Not consistently controlled",
    "outcome_measures": "Direct and/or indirect measures relevant to the stated topic",
    "main_result": "More weekly sets generally predicted more hypertrophy with diminishing returns; frequency had little independent hypertrophy effect after volume accounting.",
    "effect_size": "",
    "statistical_significance": "See source; not reducible to one test",
    "practical_significance": "More weekly sets generally predicted more hypertrophy with diminishing returns; frequency had little independent hypertrophy effect after volume accounting.",
    "study_limitations": "Heterogeneous protocols and populations; male-specific aggregate often unavailable",
    "risk_of_bias": "varies_across_included_studies",
    "male_applicability": "indirect",
    "evidence_tier": "tier_1",
    "confidence_rating": "high",
    "replication_status": "part_of_broader_evidence_base",
    "conflicting_evidence": "See evidence conclusions and gaps tables",
    "reviewer_notes": "Direct, fractional (0.5), and total indirect-set models were compared; not a per-muscle biological threshold.",
    "date_added": "2026-07-11",
    "last_reviewed_date": "2026-07-11"
  },
  {
    "study_id": "stu_0002",
    "full_citation": "Schoenfeld, Ogborn, and Krieger (2017). Dose-response relationship between weekly resistance training volume and increases in muscle mass. Journal of Sports Sciences. https://doi.org/10.1080/02640414.2016.1210197",
    "publication_year": 2017,
    "authors": "Schoenfeld, Ogborn, and Krieger",
    "study_title": "Dose-response relationship between weekly resistance training volume and increases in muscle mass",
    "journal": "Journal of Sports Sciences",
    "doi": "10.1080/02640414.2016.1210197",
    "permanent_url": "https://doi.org/10.1080/02640414.2016.1210197",
    "study_type": "systematic_review_meta_analysis",
    "research_topic": "training_volume",
    "male_only_sample": false,
    "mixed_sex_sample": true,
    "male_results_reported_separately": false,
    "male_sample_size": null,
    "total_sample_size": null,
    "participant_training_status": "mixed",
    "participant_age_mean": null,
    "participant_age_range": "adult",
    "natural_or_enhanced": "not_reported",
    "study_duration_weeks": null,
    "intervention": "Evidence synthesis of resistance-training interventions",
    "comparator": "Varied by included study",
    "training_protocol": "Varied by included study",
    "nutrition_conditions": "Not consistently controlled",
    "outcome_measures": "Direct and/or indirect measures relevant to the stated topic",
    "main_result": "Higher weekly set volumes were associated with greater hypertrophy than very low volumes.",
    "effect_size": "",
    "statistical_significance": "See source; not reducible to one test",
    "practical_significance": "Higher weekly set volumes were associated with greater hypertrophy than very low volumes.",
    "study_limitations": "Heterogeneous protocols and populations; male-specific aggregate often unavailable",
    "risk_of_bias": "varies_across_included_studies",
    "male_applicability": "indirect",
    "evidence_tier": "tier_1",
    "confidence_rating": "moderate",
    "replication_status": "part_of_broader_evidence_base",
    "conflicting_evidence": "See evidence conclusions and gaps tables",
    "reviewer_notes": "Eligibility retained only for male-applicable inference; do not infer a sex-specific effect unless marked direct.",
    "date_added": "2026-07-11",
    "last_reviewed_date": "2026-07-11"
  },
  {
    "study_id": "stu_0003",
    "full_citation": "Schoenfeld, Grgic, and Krieger (2019). How many times per week should a muscle be trained to maximize muscle hypertrophy?. Journal of Sports Sciences. https://doi.org/10.1080/02640414.2018.1555906",
    "publication_year": 2019,
    "authors": "Schoenfeld, Grgic, and Krieger",
    "study_title": "How many times per week should a muscle be trained to maximize muscle hypertrophy?",
    "journal": "Journal of Sports Sciences",
    "doi": "10.1080/02640414.2018.1555906",
    "permanent_url": "https://doi.org/10.1080/02640414.2018.1555906",
    "study_type": "systematic_review_meta_analysis",
    "research_topic": "training_frequency",
    "male_only_sample": false,
    "mixed_sex_sample": true,
    "male_results_reported_separately": false,
    "male_sample_size": null,
    "total_sample_size": null,
    "participant_training_status": "mixed",
    "participant_age_mean": null,
    "participant_age_range": "adult",
    "natural_or_enhanced": "not_reported",
    "study_duration_weeks": null,
    "intervention": "Evidence synthesis of resistance-training interventions",
    "comparator": "Varied by included study",
    "training_protocol": "Varied by included study",
    "nutrition_conditions": "Not consistently controlled",
    "outcome_measures": "Direct and/or indirect measures relevant to the stated topic",
    "main_result": "When weekly volume was equated, frequency did not significantly or meaningfully alter hypertrophy.",
    "effect_size": "",
    "statistical_significance": "See source; not reducible to one test",
    "practical_significance": "When weekly volume was equated, frequency did not significantly or meaningfully alter hypertrophy.",
    "study_limitations": "Heterogeneous protocols and populations; male-specific aggregate often unavailable",
    "risk_of_bias": "varies_across_included_studies",
    "male_applicability": "indirect",
    "evidence_tier": "tier_1",
    "confidence_rating": "high",
    "replication_status": "part_of_broader_evidence_base",
    "conflicting_evidence": "See evidence conclusions and gaps tables",
    "reviewer_notes": "Eligibility retained only for male-applicable inference; do not infer a sex-specific effect unless marked direct.",
    "date_added": "2026-07-11",
    "last_reviewed_date": "2026-07-11"
  },
  {
    "study_id": "stu_0004",
    "full_citation": "Lopez et al. (2021). Resistance Training Load Effects on Muscle Hypertrophy and Strength Gain. Medicine and Science in Sports and Exercise. https://doi.org/10.1249/MSS.0000000000002585",
    "publication_year": 2021,
    "authors": "Lopez et al.",
    "study_title": "Resistance Training Load Effects on Muscle Hypertrophy and Strength Gain",
    "journal": "Medicine and Science in Sports and Exercise",
    "doi": "10.1249/MSS.0000000000002585",
    "permanent_url": "https://doi.org/10.1249/MSS.0000000000002585",
    "study_type": "systematic_review_meta_analysis",
    "research_topic": "loading",
    "male_only_sample": false,
    "mixed_sex_sample": true,
    "male_results_reported_separately": false,
    "male_sample_size": null,
    "total_sample_size": 747,
    "participant_training_status": "mixed",
    "participant_age_mean": null,
    "participant_age_range": "adult",
    "natural_or_enhanced": "not_reported",
    "study_duration_weeks": null,
    "intervention": "Evidence synthesis of resistance-training interventions",
    "comparator": "Varied by included study",
    "training_protocol": "Varied by included study",
    "nutrition_conditions": "Not consistently controlled",
    "outcome_measures": "Direct and/or indirect measures relevant to the stated topic",
    "main_result": "Low, moderate, and high loads taken to volitional failure produced similar hypertrophy; heavier loads produced greater 1RM strength gains.",
    "effect_size": "No hypertrophy difference, p=0.113-0.995; strength favored moderate/high loads, SMD approximately 0.34-0.63",
    "statistical_significance": "See source; not reducible to one test",
    "practical_significance": "Low, moderate, and high loads taken to volitional failure produced similar hypertrophy; heavier loads produced greater 1RM strength gains.",
    "study_limitations": "Heterogeneous protocols and populations; male-specific aggregate often unavailable",
    "risk_of_bias": "varies_across_included_studies",
    "male_applicability": "indirect",
    "evidence_tier": "tier_1",
    "confidence_rating": "high",
    "replication_status": "part_of_broader_evidence_base",
    "conflicting_evidence": "See evidence conclusions and gaps tables",
    "reviewer_notes": "Eligibility retained only for male-applicable inference; do not infer a sex-specific effect unless marked direct.",
    "date_added": "2026-07-11",
    "last_reviewed_date": "2026-07-11"
  },
  {
    "study_id": "stu_0005",
    "full_citation": "Refalo et al. (2023). Influence of Resistance Training Proximity-to-Failure on Skeletal Muscle Hypertrophy. Sports Medicine. https://doi.org/10.1007/s40279-022-01784-y",
    "publication_year": 2023,